{
  "name": "wp-acf-conflict-fix",
  "title": "WordPress ACF Activation Conflict Fix",
  "description": "Resolves PHP fatal errors during ACF plugin activation by implementing function-existence checks for fallbacks.",
  "version": "1.0.0",
  "category": "coding",
  "risk": "safe",
  "author": "WHOISABHISHEKADHIKARI",
  "date_added": "2026-04-12",
  "tags": ["wordpress", "acf", "debugging", "php"]
}
