{
  "name": "wordpress-forensic-audit",
  "title": "WordPress Forensic UI & SEO Audit",
  "description": "Performs a strict side-by-side audit of WordPress templates against React/HTML sources to ensure pixel-perfection.",
  "version": "1.0.0",
  "category": "seo",
  "risk": "safe",
  "author": "WHOISABHISHEKADHIKARI",
  "date_added": "2026-04-12",
  "tags": ["wordpress", "ui-audit", "seo", "pixel-perfect"]
}
